,etoiles,n_avis,date_avis,date_experience,Société,text_total,text_clean_sentences_neg,text_clean_sentences_pos,text_stop,text_clean_sentences_neg_stop,text_clean_sentences_pos_stop
80800,5,2.0,2023-08-02 07:32:51+00:00,2023-08-01,SOFINCO,Simple et rapide. na,,Simple et rapide,Simple rapide .,,Simple rapide
45069,5,2.0,2021-02-23 11:30:21+00:00,2021-02-23,Cofidis,Rapidité efficacité. Conseiller à l'écoute. Réponse rapide.,,Rapidité efficacité. Conseiller à l' écoute. Réponse rapide,Rapidité efficacité . Conseiller écoute . Réponse rapide .,,Rapidité efficacité . Conseiller l ' écoute . Réponse rapide
81625,1,2.0,2016-06-07 04:18:33+00:00,2016-06-07,SOFINCO,refus de 600 euros sans raison j'ai aucun crédit et 2100 euros par mois. na,refus de 600 euros sans raison j' ai aucun crédit et 2100 euros par mois,,refus 600 euros raison aucun crédit 2100 euros mois .,refus 600 euros raison j ' aucun crédit 2100 euros mois,
60859,5,1.0,2017-06-24 17:57:58+00:00,2017-06-24,Immoprt,"""Rapide et efficace. Conseillère à l'écoute, efficace avec une offre concrète en moins d'une semaine.""",,Rapide et efficace. Conseillère à l' écoute efficace avec une offre concrète en moins d' une semaine,"""Rapide efficace . Conseillère écoute , efficace offre concrète semaine .""",,Rapide efficace . Conseillère l ' écoute efficace offre concrète d ' semaine
80796,1,3.0,2023-08-02 10:29:49+00:00,2023-07-25,SOFINCO,Demande déposée le 25 juillet… tjrs…. Demande déposée le 25 juillet… tjrs aucune réponse à l’heure actuelle J’ai tenté d’appeler hier après 3 bips factures on a raccroché..Je rappelle aujourd’hui et je tombe sur un conseiller fort désagréable qui me répond « on vous renvoie un lien pour vérification d’identité d’ici 1 a 2 semaines alors que je l’ai fait à 2 reprises !J’ai déjà fait 3 demandes de crédits chez vous honores et soldés…Là je suis très contrariée…Versement en 7 jours ???Au bout de 9 jours le dossier est tjrs à l’étude !!!,Demande déposée le 25 juillet. Demande déposée le 25 juillet. tjrs aucune réponse à l’ heure actuelle J’ ai tenté d’ appeler hier après 3 bips factures on a raccroché. Je rappelle aujourd’hui et je tombe sur un conseiller fort désagréable qui me répond   on vous renvoie un lien pour vérification d’ identité d’ ici 1 a 2 semaines alors que je l’ ai fait à 2 reprises. Là je suis très contrariée. Versement en 7 jours. Au bout de 9 jours le dossier est tjrs à l’ étude,J’ ai déjà fait 3 demandes de crédits chez vous honores et soldés,Demande déposée 25 juillet … tjrs … . Demande déposée 25 juillet … tjrs aucune réponse heure actuelle J’ tenté appeler hier 3 bips factures raccroché .. Je rappelle aujourd’hui tombe conseiller fort désagréable répond «   renvoie lien vérification identité ici 1 2 semaines 2 reprises ! J’ 3 demandes crédits honores soldés … Là contrariée … Versement 7 jours ? ? ? Au bout 9 jours dossier tjrs étude ! ! !,Demande déposée 25 juillet . Demande déposée 25 juillet . tjrs aucune réponse l ’ heure actuelle J ’ tenté d ’ appeler hier 3 bips factures raccroché . Je rappelle aujourd’hui tombe conseiller fort désagréable répond    renvoie lien vérification d ’ identité d ’ ici 1 2 semaines l ’ 2 reprises . Là contrariée . Versement 7 jours . Au bout 9 jours dossier tjrs l ’ étude,J ’ 3 demandes crédits honores soldés
32554,4,3.0,2022-10-25 07:27:20+00:00,2022-10-03,Cofidis,J'ai pu obtenir rapidement un prêt chez…. J'ai pu obtenir rapidement un prêt chez COFIDIS sans être noyée dans les démarches administratives qui sont assez souvent d'une lenteur agaçante.Les conseillers sont compétents et prennent du temps avec les clients pour leur trouver une solution.,J' ai pu obtenir rapidement un prêt chez COFIDIS sans être noyée dans les démarches administratives qui sont assez souvent d' une lenteur agaçante,J' ai pu obtenir rapidement un prêt chez. Les conseillers sont compétents et prennent du temps avec les clients pour leur trouver une solution,J' obtenir rapidement prêt … . J' obtenir rapidement prêt COFIDIS noyée démarches administratives lenteur agaçante . Les conseillers compétents prennent temps clients trouver solution .,J ' obtenir rapidement prêt COFIDIS noyée démarches administratives d ' lenteur agaçante,J ' obtenir rapidement prêt . Les conseillers compétents prennent temps clients trouver solution
73568,5,1.0,2023-10-16 18:28:48+00:00,2023-10-12,Monabanq,Facilité de gestion du compte par internet. Pour mon utilisation (banque secondaire dans l'immédiat) je suis très satisfait de la réactivité et rapidité des transactions. Facilité pour accomplir toutes les opérations courantes d'un compte bancaire et ce par internet.,,Facilité de gestion du compte par internet. Pour mon utilisation banque secondaire dans l' immédiat je suis très satisfait de la réactivité et rapidité des transactions. Facilité pour accomplir toutes les opérations courantes d' un compte bancaire et ce par internet,Facilité gestion compte internet . Pour utilisation ( banque secondaire immédiat ) satisfait réactivité rapidité transactions . Facilité accomplir opérations courantes compte bancaire internet .,,Facilité gestion compte internet . Pour utilisation banque secondaire l ' immédiat satisfait réactivité rapidité transactions . Facilité accomplir opérations courantes d ' compte bancaire internet
64058,5,1.0,2022-05-08 15:12:52+00:00,2022-05-08,Pixpay,"""Pixpay donne la possibilité de vraiment…. Pixpay donne la possibilité de vraiment laisser faire les ados avec leurs budgets, mais les parents garde la main sur tout (sauf les dépenses) avec le blocage en un clic les ados ne peuvent pas non-plus faire n'importe quoi.Mon seul regret, ne pas pourvoir faire de prélèvements sur Pixpay. Exemple : votre ados ne peut pas s'inscrire à une salle de sport et être prélever dessus.""",Pixpay donne la possibilité de vraiment laisser faire les ados avec leurs budgets mais les parents garde la main sur tout sauf les dépenses avec le blocage en un clic les ados ne peuvent pas non-plus faire n' importe quoi. Mon seul regret ne pas pourvoir faire de prélèvements sur Pixpay. Exemple votre ados ne peut pas s' inscrire à une salle de sport et être prélever dessus,donne la possibilité de vraiment,"""Pixpay donne possibilité vraiment … . Pixpay donne possibilité vraiment faire ados budgets , parents garde main ( dépenses ) blocage clic ados non-plus faire . Mon regret , pourvoir faire prélèvements Pixpay . Exemple : ados inscrire salle sport prélever .""",Pixpay donne possibilité vraiment faire ados budgets parents garde main dépenses blocage clic ados non-plus faire n ' . Mon regret pourvoir faire prélèvements Pixpay . Exemple ados s ' inscrire salle sport prélever,donne possibilité vraiment
101138,5,1.0,2021-07-11 13:09:24+00:00,2021-07-09,OrangeBank,"""Je suis satisfait du service client via messenger. Je suis satisfait du service client via messenger, j'ai eu un problème avec ma carte bancaire orange, je pouvais rien payé en magasin et en ligne car ma carte était bloquée à distance, j'ai dû prouver qu'elle était toujours en ma possession pour la réactiver, j'ai pas attendu très longtemps pour l'activation,il m'a dit d'attendre 1h et elle est opérationnel, le conseiller et été à l'écoute et très sympa, merci.""",,Je suis satisfait du service client via messenger. Je suis satisfait du service client via messenger j' ai eu un problème avec ma carte bancaire orange je pouvais rien payé en magasin et en ligne car ma carte était bloquée à distance j' ai dû prouver qu' elle était toujours en ma possession pour la réactiver j' ai pas attendu très longtemps pour l' activation il m' a dit d' attendre 1h et elle est opérationnel le conseiller et été à l' écoute et très sympa merci,"""Je satisfait service client messenger . Je satisfait service client messenger , problème carte bancaire orange , pouvais rien payé magasin ligne carte bloquée distance , dû prouver possession réactiver , activation , attendre 1h opérationnel , conseiller été écoute sympa , .""",,Je satisfait service client messenger . Je satisfait service client messenger j ' problème carte bancaire orange pouvais rien payé magasin ligne carte bloquée distance j ' dû prouver qu ' possession réactiver j ' l ' activation m ' d ' attendre 1h opérationnel conseiller été l ' écoute sympa
26102,1,1.0,2020-03-17 17:52:23+00:00,2020-03-17,Anytime,"""Bonjour nous sommes une entreprise. Bonjour nous sommes une entreprise,  nous avons envoyé un chèque de  plus de 5000 euros en date du 5 février 2020 reçu le 7 février 2020 par vos soins.l'encaissement de ce chèque  était de 21 jours ouvrés depuis le 7 mars le chèque devrait être sur le compte. Chaque jour vous me dites demain...vous mettez mon entreprise en péril dans ces jours difficiles. Nous sommes le 17 mars sans dépôt du chèque demain sur mon compte, je ferai un déposerai plainte ! Le coronavirus semble avoir bon dos pour votre propre compte !J informerai tous les clients et internautes de votre manquement inadmissible !""",Bonjour nous sommes une entreprise. Bonjour nous sommes une entreprise   nous avons envoyé un chèque de   plus de 5000 euros en date du 5 février 2020 reçu le 7 février 2020 par vos soins.l' encaissement de ce chèque   était de 21 jours ouvrés depuis le 7 mars le chèque devrait être sur le compte. Nous sommes le 17 mars sans dépôt du chèque demain sur mon compte je ferai un déposerai plainte. Le coronavirus semble avoir bon dos pour votre propre compte. J informerai tous les clients et internautes de votre manquement inadmissible,Chaque jour vous me dites demain vous mettez mon entreprise en péril dans ces jours difficiles,"""Bonjour sommes entreprise . Bonjour sommes entreprise ,   envoyé chèque   5000 euros date 5 février 2020 reçu 7 février 2020 soins.l' encaissement chèque   21 jours ouvrés 7 mars chèque devrait compte . Chaque jour dites demain ... mettez entreprise péril jours difficiles . Nous sommes 17 mars dépôt chèque demain compte , ferai déposerai plainte ! Le coronavirus bon dos propre compte ! J informerai clients internautes manquement inadmissible !""",Bonjour sommes entreprise . Bonjour sommes entreprise    envoyé chèque    5000 euros date 5 février 2020 reçu 7 février 2020 soins.l ' encaissement chèque    21 jours ouvrés 7 mars chèque devrait compte . Nous sommes 17 mars dépôt chèque demain compte ferai déposerai plainte . Le coronavirus bon dos propre compte . J informerai clients internautes manquement inadmissible,Chaque jour dites demain mettez entreprise péril jours difficiles
76376,5,2.0,2022-12-10 11:38:22+00:00,2022-12-09,LaBanquePostale,Merci beaucoup la banque postale. na,,Merci beaucoup la banque postale,Merci beaucoup banque postale .,,Merci beaucoup banque postale
66563,5,1.0,2023-10-13 21:28:58+00:00,2023-10-12,Pixpay,"""Bonne appli. Bonne appli, simple pour moi et mon fils. J’ai pris PIXPAY quand mon fils de 15 ans est entré en apprentissage, je voulais qu’il commence à gérer son argent avec plus de facilité qu’avec un compte bancaire et je ne regrette pas. 🙂""",J’ ai pris PIXPAY,Bonne appli. Bonne appli simple pour moi et mon fils. quand mon fils de 15 ans est entré en apprentissage je voulais qu’ il commence à gérer son argent avec plus de facilité qu’ avec un compte bancaire et je ne regrette pas,"""Bonne appli . Bonne appli , simple fils . J’ pris PIXPAY fils 15 ans entré apprentissage , voulais commence gérer argent facilité compte bancaire regrette . 🙂""",J ’ pris PIXPAY,Bonne appli . Bonne appli simple fils . fils 15 ans entré apprentissage voulais qu ’ commence gérer argent facilité qu ’ compte bancaire regrette
53483,5,16.0,2023-08-24 20:36:23+00:00,2023-08-23,MaFrenchBank,"""Bon service. Cliente depuis une année, j’apprécie beaucoup l’application qui permet de suivre en temps réel les mouvements bancaires, j’apprécie tout autant les notifications de l’application qui vous informe instantanément des paiements échoués ou des retraits à l’étranger .Grâce à ce service , j’ai pu m’apercevoir que les donnés de ma carte était en possession d’une autre personne et que plusieurs tentatives de paiement avait échoué . J’aime aussi la tirelire qui permet d’économiser et d’emprunter à la fameuse tirelire. Et surtout les paiements à l’étranger ainsi que les retraits sont sans frais. Pas de frais cachés et pas de découvert !""",Pas de frais cachés et pas de découvert,Bon service. Cliente depuis une année j’ apprécie beaucoup l’ application qui permet de suivre en temps réel les mouvements bancaires j’ apprécie tout autant les notifications de l’ application qui vous informe instantanément des paiements échoués ou des retraits à l’ étranger .Grâce à ce service j’ ai pu m’ apercevoir que les donnés de ma carte était en possession d’ une autre personne et que plusieurs tentatives de paiement avait échoué. J’ aime aussi la tirelire qui permet d’ économiser et d’ emprunter à la fameuse tirelire. Et surtout les paiements à l’ étranger ainsi que les retraits sont sans frais,"""Bon service . Cliente année , apprécie beaucoup application temps réel mouvements bancaires , apprécie autant notifications application informe instantanément paiements échoués retraits étranger .Grâce service , apercevoir donnés carte possession tentatives paiement échoué . J’ aime tirelire économiser emprunter fameuse tirelire . Et paiements étranger retraits frais . Pas frais cachés découvert !""",Pas frais cachés découvert,Bon service . Cliente année j ’ apprécie beaucoup l ’ application temps réel mouvements bancaires j ’ apprécie autant notifications l ’ application informe instantanément paiements échoués retraits l ’ étranger .Grâce service j ’ m ’ apercevoir donnés carte possession d ’ tentatives paiement échoué . J ’ aime tirelire d ’ économiser d ’ emprunter fameuse tirelire . Et paiements l ’ étranger retraits frais
20802,3,6.0,2012-03-01 15:18:09+00:00,2012-03-01,Fortuneo,"""du bon et du moins bon. C'est à mon avis la meilleure banque en ligne. Les frais sont bas et les ordres sont exécutés correctement. Le seul reproche, c'est le site Internet. Les temps de réponse ne sont pas bons, délais de chargement de pages souvent expirés, l'information sur les titres côtés hors Europe  est difficile à trouver... Je reste fidèle à Fortuneo et je les recommande à mes amis mais je recherche les informations boursières ailleurs (nasdaq.com, boursier.com, advfn, ...). Que cela ne vous rebute pas, ils sont fiables et très corrects.""",du bon et du moins bon. Le seul reproche c' est le site Internet,C' est à mon avis la meilleure banque en ligne. Les frais sont bas et les ordres sont exécutés correctement. Les temps de réponse ne sont pas bons délais de chargement de pages souvent expirés l' information sur les titres côtés hors Europe   est difficile à trouver Je reste fidèle à Fortuneo et je les recommande à mes amis mais je recherche les informations boursières ailleurs nasdaq.com boursier.com advfn. Que cela ne vous rebute pas ils sont fiables et très corrects,"""bon bon . C' avis meilleure banque ligne . Les frais ordres exécutés correctement . Le reproche , site Internet . Les temps réponse bons , délais chargement pages expirés , information titres côtés Europe   difficile trouver ... Je fidèle Fortuneo recommande amis recherche informations boursières ailleurs ( nasdaq.com , boursier.com , advfn , ... ) . Que rebute , fiables corrects .""",bon bon . Le reproche c ' site Internet,C ' avis meilleure banque ligne . Les frais ordres exécutés correctement . Les temps réponse bons délais chargement pages expirés l ' information titres côtés Europe    difficile trouver Je fidèle Fortuneo recommande amis recherche informations boursières ailleurs nasdaq.com boursier.com advfn . Que rebute fiables corrects
82016,5,2.0,2020-11-19 20:46:17+00:00,2020-11-19,CIBFormation,Formation en visio conférence très…. Formation en visio conférence très enrichissante. Merci à pascal pour son enthousiasme dans sa façon de nous faire partager son expérience.,,Formation en visio conférence très. Formation en visio conférence très enrichissante. Merci à pascal pour son enthousiasme dans sa façon de nous faire partager son expérience,Formation visio conférence … . Formation visio conférence enrichissante . Merci pascal enthousiasme faire partager expérience .,,Formation visio conférence . Formation visio conférence enrichissante . Merci pascal enthousiasme faire partager expérience
52859,1,2.0,2019-11-09 17:19:37+00:00,2019-11-09,Oney,"""J'ai acheté un telephone,à payer en 4…. J'ai acheté un telephone,à payer en 4 fois.A ma surprise je vois qu'on m'a mis 1900 euros à disposition.J'ai envoyé une lettre recommandée avec accusé de réception pour renoncer dans les  délais de 14 jours.Je reçois  la réponse, mais la résiliation se fera à la date d'échéance. Alors que  la loi me donne 14 jours pour renoncer.Arnaque arnaque arnaque. Si vous allez à Auchan ,mefiez vous.""",J' ai acheté un telephone à payer en 4. J' ai acheté un telephone à payer en 4 fois. A ma surprise je vois qu' on m' a mis 1900 euros à disposition. J' ai envoyé une lettre recommandée avec accusé de réception pour renoncer dans les   délais de 14 jours. Je reçois   la réponse mais la résiliation se fera à la date d' échéance. Alors que   la loi me donne 14 jours pour renoncer. Arnaque arnaque. Si vous allez à Auchan mefiez vous,,"""J' acheté telephone , payer 4 … . J' acheté telephone , payer 4 fois . A surprise vois mis 1900 euros disposition . J' envoyé lettre recommandée accusé réception renoncer   délais 14 jours . Je reçois   réponse , résiliation fera date échéance . Alors   loi donne 14 jours renoncer . Arnaque arnaque arnaque . Si allez Auchan , mefiez .""",J ' acheté telephone payer 4 . J ' acheté telephone payer 4 fois . A surprise vois qu ' m ' mis 1900 euros disposition . J ' envoyé lettre recommandée accusé réception renoncer    délais 14 jours . Je reçois    réponse résiliation fera date d ' échéance . Alors    loi donne 14 jours renoncer . Arnaque arnaque . Si allez Auchan mefiez,
38129,5,1.0,2022-01-03 17:37:54+00:00,2022-01-03,Cofidis,Je vous souhaite une bonne année 2022…. Je vous souhaite une bonne année 2022 et COFIDIS et sérieux et très rapide pour nous soulager quand un problème survient merci COFIDIS,,Je vous souhaite une bonne année 2022. Je vous souhaite une bonne année 2022 et COFIDIS et sérieux et très rapide pour nous soulager quand un problème survient merci COFIDIS,Je souhaite bonne année 2022 … . Je souhaite bonne année 2022 COFIDIS sérieux rapide soulager problème survient COFIDIS,,Je souhaite bonne année 2022 . Je souhaite bonne année 2022 COFIDIS sérieux rapide soulager problème survient COFIDIS
100181,5,1.0,2022-01-25 12:29:58+00:00,2022-01-25,OrangeBank,Super ecoute. na,,Super ecoute,Super ecoute .,,Super ecoute
101985,5,2.0,2020-10-01 09:20:45+00:00,2020-10-01,OrangeBank,"""Orange rue de Rennes Paris 6e. Saïd nous a vraiment bien accompagné pour monter un package banque, internet, télé, téléphone et mobile. Doté d’une grande patience, d’un professionnalisme et d’un bon sens de l’humour, il a été tellement bien veillant envers nous. Encore une fois, mille merci à Saïd et l’équipe Orange rue de Rennes aussi !""",,Orange rue de Rennes Paris 6e. Saïd nous a vraiment bien accompagné pour monter un package banque internet télé téléphone et mobile. Doté d’ une grande patience d’ un professionnalisme et d’ un bon sens de l’ humour il a été tellement bien veillant envers nous. Encore une fois mille merci à Saïd et l’ équipe Orange rue de Rennes aussi,"""Orange rue Rennes Paris 6e . Saïd vraiment bien accompagné monter package banque , internet , télé , téléphone mobile . Doté grande patience , professionnalisme bon sens humour , été bien veillant . Encore fois , Saïd équipe Orange rue Rennes !""",,Orange rue Rennes Paris 6e . Saïd vraiment bien accompagné monter package banque internet télé téléphone mobile . Doté d ’ grande patience d ’ professionnalisme d ’ bon sens l ’ humour été bien veillant . Encore fois Saïd l ’ équipe Orange rue Rennes
69220,5,7.0,2023-06-06 18:46:44+00:00,2023-06-06,Monabanq,Entièrement satisfaite de cette banque…. Entièrement satisfaite de cette banque depuis 2018,,Entièrement satisfaite de cette banque. Entièrement satisfaite de cette banque depuis 2018,Entièrement satisfaite banque … . Entièrement satisfaite banque 2018,,Entièrement satisfaite banque . Entièrement satisfaite banque 2018
19074,5,2.0,2023-03-29 18:50:39+00:00,2023-03-14,Fortuneo,"""pas de pbs pour accéder au compte…. pas de pbs pour accéder au compte client, et le site est très clair à utiliser...merci""",,pas de pbs pour accéder au compte. pas de pbs pour accéder au compte client et le site est très clair à utiliser merci,"""pbs accéder compte … . pbs accéder compte client , site clair utiliser ...""",,pbs accéder compte . pbs accéder compte client site clair utiliser
11919,1,57.0,2022-10-07 12:44:47+00:00,2022-10-07,Floabank,"""Relation client catastrophique. Aucun interlocuteur en cas de souci. La carte vous offre bon nombre d'avantages, mais impossible de les joindre en cas de problème. Donc je vous les déconseille fortement. J'ai acheté une e-carte cadeau Casino de 100 euros que je n'ai jamais reçu. Et j'ai un prélèvement frauduleux sur mon compte, mais leurs lignes sont saturées. Quand on obtient quelqu'1, il vous met en attente et vous rebasculez dans la queue au bout d'1 moment. Bref, une horreur. Préférez une banque plus classique où vous pouvez joindre quelqu'un. Voire, faire opposition d'une opération sur leur application. @Floabank, pour information, mon identifiant est le 81136746""",Relation client catastrophique. Aucun interlocuteur en cas de souci. La carte vous offre bon nombre d' avantages mais impossible de les joindre en cas de problème. Donc je vous les déconseille fortement. J' ai acheté une e-carte cadeau Casino de 100 euros que je n' ai jamais reçu. Et j' ai un prélèvement frauduleux sur mon compte mais leurs lignes sont saturées. Quand on obtient quelqu'1 il vous met en attente et vous rebasculez dans la queue au bout d'1 moment. Bref une horreur. Préférez une banque plus classique où vous pouvez joindre quelqu' un. Voire faire opposition d' une opération sur leur application,@Floabank pour information mon identifiant est le 81136746,"""Relation client catastrophique . Aucun interlocuteur cas souci . La carte offre bon nombre avantages , impossible joindre cas problème . Donc déconseille fortement . J' acheté e-carte cadeau Casino 100 euros jamais reçu . Et prélèvement frauduleux compte , lignes saturées . Quand obtient quelqu'1 , met attente rebasculez queue bout d'1 moment . Bref , horreur . Préférez banque classique pouvez joindre quelqu' . Voire , faire opposition opération application . @Floabank , information , identifiant 81136746""",Relation client catastrophique . Aucun interlocuteur cas souci . La carte offre bon nombre d ' avantages impossible joindre cas problème . Donc déconseille fortement . J ' acheté e-carte cadeau Casino 100 euros n ' jamais reçu . Et j ' prélèvement frauduleux compte lignes saturées . Quand obtient quelqu'1 met attente rebasculez queue bout d'1 moment . Bref horreur . Préférez banque classique pouvez joindre quelqu ' . Voire faire opposition d ' opération application,@Floabank information identifiant 81136746
34453,4,1.0,2022-07-12 09:12:24+00:00,2022-07-12,Cofidis,Facilité de remplir une demande de…. Facilité de remplir une demande de prêt.  Accompagnement apprécié par une personne aimable et compatissante. Par contre le délai de réception des fonds a été plus long. 15 jours après la validation de l'accord.bonne expérience pour l'instant.,Par contre le délai de réception des fonds a été plus long,Facilité de remplir une demande de. Facilité de remplir une demande de prêt. Accompagnement apprécié par une personne aimable et compatissante. 15 jours après la validation de l' accord.bonne expérience pour l' instant,Facilité remplir demande … . Facilité remplir demande prêt .   Accompagnement apprécié aimable compatissante . Par contre délai réception fonds été long . 15 jours validation accord.bonne expérience instant .,Par contre délai réception fonds été long,Facilité remplir demande . Facilité remplir demande prêt . Accompagnement apprécié aimable compatissante . 15 jours validation l ' accord.bonne expérience l ' instant
45456,5,3.0,2021-02-02 14:33:37+00:00,2021-02-02,Cofidis,Très satisfaite. na,,Très satisfaite,Très satisfaite .,,Très satisfaite
