,etoiles,n_avis,date_avis,date_experience,Société,text_total,text_clean_sentences_neg,text_clean_sentences_pos,text_stop,text_clean_sentences_neg_stop,text_clean_sentences_pos_stop
50227,2,2.0,2021-10-16 21:44:03+00:00,2021-10-16,Oney,"""Fiche banque de France. Bonjour Moi , en téléphonant aujourd'hui  pour une raison .On m apprends que je suis fiche banque de France .La je rigole en disant c est quoi cette bêtiseOn me répond pas une bêtise vous êtes ficher depuis le 24 juin , aujourd'hui 16 octobre on me dit ça Alors que j ai un chéquier une CB visa et rien de ma banque .J aimerais comprendre d'ou sort cette belle absurte .""",Moi en téléphonant aujourd'hui   pour une raison .On. m apprends que je suis fiche banque de France .La je rigole en disant c est quoi cette bêtiseOn me répond pas une bêtise vous êtes ficher depuis le 24 juin aujourd'hui 16 octobre on me dit ça Alors que j ai un chéquier une CB visa et rien de ma banque .J aimerais comprendre d' ou sort cette belle absurte,Fiche banque de France,"""Fiche banque France . Bonjour Moi , téléphonant aujourd'hui   raison .On m apprends fiche banque France .La rigole disant c bêtiseOn répond bêtise êtes ficher 24 juin , aujourd'hui 16 octobre Alors j chéquier CB visa rien banque .J aimerais comprendre sort belle absurte .""",Moi téléphonant aujourd'hui    raison .On . m apprends fiche banque France .La rigole disant c bêtiseOn répond bêtise êtes ficher 24 juin aujourd'hui 16 octobre Alors j chéquier CB visa rien banque .J aimerais comprendre d ' sort belle absurte,Fiche banque France
80894,4,2.0,2023-07-14 12:48:46+00:00,2023-07-11,SOFINCO,Très bien. Sofinco j'avais besoin d'être et ils ont répondu favorablement et j'apprécie beaucoup,,Très bien. j' avais besoin d' être et ils ont répondu favorablement et j' apprécie beaucoup,Très bien . Sofinco besoin répondu favorablement apprécie beaucoup,,Très bien . j ' besoin d ' répondu favorablement j ' apprécie beaucoup
36420,5,2.0,2022-04-11 17:52:01+00:00,2022-04-11,Cofidis,Très satisfaite. na,,Très satisfaite,Très satisfaite .,,Très satisfaite
9650,4,1.0,2023-05-05 12:01:11+00:00,2023-05-05,Floabank,Échange très long mais qui aboutira à…. Échange très long mais qui aboutira à un résultat je l'espère.,Échange très long mais qui aboutira à,Échange très long mais qui aboutira à un résultat je l' espère,Échange long aboutira … . Échange long aboutira résultat espère .,Échange long aboutira,Échange long aboutira résultat l ' espère
49439,2,1.0,2022-12-01 12:57:58+00:00,2022-11-27,Oney,"""je sais pas quoi dire sur cette banque…. je sais pas quoi dire sur cette banque mais sa commencer chez moi même avant d'avoir un crédit , j'ai finalisé toute les procédures pour acheter un samsung , normalement je reçoie une avis dans 48h max d'après leurs email mais non sa fait 5 jours et toujours rien.""",je sais pas quoi dire sur cette banque. je sais pas quoi dire sur cette banque mais sa commencer chez moi même avant d' avoir un crédit j' ai finalisé toute les procédures pour acheter un samsung normalement je reçoie une avis dans 48h max d' après leurs email mais non sa fait 5 jours et toujours rien,,"""sais banque … . sais banque commencer crédit , finalisé procédures acheter samsung , normalement reçoie avis 48h max email non 5 jours rien .""",sais banque . sais banque commencer d ' crédit j ' finalisé procédures acheter samsung normalement reçoie avis 48h max d ' email non 5 jours rien,
101013,1,1.0,2021-08-11 10:08:00+00:00,2021-08-11,OrangeBank,Utilisation de mon compte Orange bank…. Utilisation de mon compte Orange bank toujours Impossible 6 jours après,Impossible 6 jours,Utilisation de mon compte Orange bank. Utilisation de mon compte Orange. bank toujours,Utilisation compte Orange bank … . Utilisation compte Orange bank Impossible 6 jours,Impossible 6 jours,Utilisation compte Orange bank . Utilisation compte Orange . bank
95126,4,5.0,2022-05-24 22:12:32+00:00,2022-05-24,OrangeBank,Bien. 🤩 bon rapport qualité prix,,🤩 bon rapport qualité,Bien . 🤩 bon rapport qualité prix,,🤩 bon rapport qualité
89741,5,1.0,2023-05-31 21:43:17+00:00,2023-04-27,OrangeBank,Réactive aux questions. na,,Réactive aux questions,Réactive questions .,,Réactive questions
67352,5,2.0,2021-07-28 09:24:07+00:00,2021-07-28,Vybe,C est canon. C est canon. Il réponde rapidement et c est super bien fait,,C est canon. C est canon. Il réponde rapidement et c est super bien fait,C canon . C canon . Il réponde rapidement c super bien,,C canon . C canon . Il réponde rapidement c super bien
46667,1,8.0,2020-12-09 15:41:10+00:00,2020-12-09,Cofidis,"""Je viens de finir un appel avec une…. Je viens de finir un appel avec une conseillère cofidis ,honteux de parler comme ça au gens je recommande pas cette organisme alors que jai toujours été client depuis plusieurs années sans soucis.""",Je viens de finir un appel avec une. Je viens de finir un appel avec une conseillère cofidis honteux de parler comme ça au gens je recommande pas cette organisme alors que jai toujours été client depuis plusieurs années sans soucis,,"""Je viens finir appel … . Je viens finir appel conseillère cofidis , honteux recommande organisme jai été client années soucis .""",Je viens finir appel . Je viens finir appel conseillère cofidis honteux recommande organisme jai été client années soucis,
100499,4,2.0,2021-11-25 17:01:46+00:00,2021-11-25,OrangeBank,Simple et efficace. na,,Simple et efficace,Simple efficace .,,Simple efficace
1659,1,2.0,2023-10-14 12:10:37+00:00,2023-10-14,MaBanqueBNPParibas,"""C'est du vol.. C'est du vol.Ils me retirent 32 euros chaques mois car ils estiment que je dépense trop alors que c'est mon argent !Ils refusent de me donner le détail des opérations et des factures qu'ils m'extorquent de force tous les mois !Je ne peux donc pas savoir à quoi ça sert.Lors d'un transfert sur mon compte aux USA, ils ont perdu l'argent et m'ont fait payer 150 euros pour la récupérer !Du flou, pas d'information, l'argent disparaît.Je change de banque sur le champs !""",C' est du vol. C' est du vol. Ils me retirent 32 euros chaques mois car ils estiment que je dépense trop alors que c' est mon argent. Ils refusent de me donner le détail des opérations et des factures qu' ils m' extorquent de force tous les mois. Je ne peux donc pas savoir à quoi ça sert. Lors d' un transfert sur mon compte aux USA ils ont perdu l' argent et m' ont fait payer 150 euros pour la récupérer. Du flou pas d' information l' argent disparaît. Je change de banque sur le champs,,"""C' vol .. C' vol . Ils retirent 32 euros chaques mois estiment dépense trop argent ! Ils refusent donner détail opérations factures extorquent force mois ! Je savoir sert . Lors transfert compte USA , perdu argent payer 150 euros récupérer ! Du flou , information , argent disparaît . Je change banque champs !""",C ' vol . C ' vol . Ils retirent 32 euros chaques mois estiment dépense trop c ' argent . Ils refusent donner détail opérations factures qu ' m ' extorquent force mois . Je savoir sert . Lors d ' transfert compte USA perdu l ' argent m ' payer 150 euros récupérer . Du flou d ' information l ' argent disparaît . Je change banque champs,
83511,5,1.0,2023-06-01 20:39:38+00:00,2023-06-01,BoursoramaBanque,super qualité. na,,super qualité,super qualité .,,super qualité
26361,5,1.0,2019-05-15 11:36:07+00:00,2019-05-15,Anytime,Enfin un service moderne bancaire. Enfin un service moderne bancaire ! Très bon service de Anyti.me et surtout : une suivie clientèle exemplaire !!! Vous avez une question.... ils vous répondent en ligne dans les minutes qui suivent et si nécessaire trouverons une solution.Le service comme Anyti.me (et autres) c'est le futur.Continuez ainsi !,Vous avez une question. Continuez ainsi,Enfin un service moderne bancaire. Enfin un service moderne bancaire. Très bon service de Anyti.me. et surtout une suivie clientèle exemplaire. ils vous répondent en ligne dans les minutes qui suivent et si nécessaire trouverons une solution. Le service comme Anyti.me et autres c' est le futur,Enfin service moderne bancaire . Enfin service moderne bancaire ! Très bon service Anyti.me : suivie clientèle exemplaire ! ! ! Vous avez question .... répondent ligne minutes suivent nécessaire trouverons solution . Le service Anyti.me ( ) futur . Continuez !,Vous avez question . Continuez,Enfin service moderne bancaire . Enfin service moderne bancaire . Très bon service Anyti.me . suivie clientèle exemplaire . répondent ligne minutes suivent nécessaire trouverons solution . Le service Anyti.me c ' futur
48033,4,1.0,2023-10-19 15:05:22+00:00,2023-10-11,Cofidis,Pas réellement répondu à mes attentes. On a refusé ma première demande donc j'ai pris celle qu'ils m'ont proposé pour ensuite me dire que j'aurais pu demander plus,Pas réellement répondu à mes attentes. On a refusé ma première demande donc j' ai pris celle qu' ils m' ont proposé pour ensuite me dire que j' aurais pu demander plus,,Pas réellement répondu attentes . On refusé demande pris proposé ensuite aurais demander,Pas réellement répondu attentes . On refusé demande j ' pris qu ' m ' proposé ensuite j ' aurais demander,
42835,5,1.0,2021-06-08 14:59:58+00:00,2021-06-08,Cofidis,Réactivité. Réactivité Professionnel Juste merci,Réactivité Professionnel,Juste merci,Réactivité . Réactivité Professionnel Juste,Réactivité Professionnel,Juste
102426,5,2.0,2023-10-10 16:58:05+00:00,2023-10-10,OrangeBank,"""Les réponses. Les réponses, même si elles ne sont pas satisfaisantes, ont été données de façon pertinente et efficace""",Les réponses,Les réponses même si elles ne sont pas satisfaisantes ont été données de façon pertinente et efficace,"""Les réponses . Les réponses , satisfaisantes , été données pertinente efficace""",Les réponses,Les réponses satisfaisantes été données pertinente efficace
79553,1,2.0,2021-11-09 21:49:43+00:00,2021-11-09,LCL,"""Déposé un chèque salaire signé et daté…. Déposé un chèque salaire signé et daté jeudi 04/11 soir dans une borne automate à la lcl 5avenue, Marseille, aujourd'hui le 09/11 soir pas encore reçu un centime sur mon compte au contraire je suis en négatif. C est le moment de changer de banque.""",Déposé un chèque salaire signé et daté jeudi 04/11 soir dans une borne automate à la lcl 5avenue Marseille aujourd'hui le 09/11 soir pas encore reçu un centime sur mon compte au contraire je suis en négatif,Déposé un chèque salaire signé et daté. C est le moment de changer de banque,"""Déposé chèque salaire signé daté … . Déposé chèque salaire signé daté jeudi 04/11 soir borne automate lcl 5avenue , Marseille , aujourd'hui 09/11 soir reçu centime compte contraire négatif . C moment changer banque .""",Déposé chèque salaire signé daté jeudi 04/11 soir borne automate lcl 5avenue Marseille aujourd'hui 09/11 soir reçu centime compte contraire négatif,Déposé chèque salaire signé daté . C moment changer banque
37129,5,1.0,2022-02-16 10:29:43+00:00,2022-02-16,Cofidis,"""Simple. Simple, rapide, efficace !""",,Simple rapide efficace,"""Simple . Simple , rapide , efficace !""",,Simple rapide efficace
39228,5,1.0,2021-11-09 17:14:46+00:00,2021-11-09,Cofidis,Organisme très compétent très…. Organisme très compétent très accueillant beaucoup de qualités chez leurs collaborateurs,,Organisme très compétent très. Organisme très compétent très accueillant beaucoup de qualités chez leurs collaborateurs,Organisme compétent … . Organisme compétent accueillant beaucoup qualités collaborateurs,,Organisme compétent . Organisme compétent accueillant beaucoup qualités collaborateurs
97356,4,7.0,2022-04-04 09:46:47+00:00,2022-04-04,OrangeBank,Très bon accueil et de très bons…. Très bon accueil et de très bons conseils pour,,Très bon accueil et de très bons. Très bon accueil et de très bons conseils,Très bon accueil bons … . Très bon accueil bons conseils,,Très bon accueil bons . Très bon accueil bons conseils
97324,5,3.0,2022-04-04 14:55:37+00:00,2022-04-04,OrangeBank,Rapide efficace. na,,Rapide efficace,Rapide efficace .,,Rapide efficace
49147,1,6.0,2023-04-26 10:46:26+00:00,2023-04-20,Oney,"""Organisme de crédit qui vous refuse le…. Organisme de crédit qui vous refuse le paiement en 3fois pour un montant d’environ 600 euros alors que vous êtes solvable et créditeur sur votre compte, donc très embêtant et énervant.En plus quand on les contacte, pas de réponse pour résoudre le problème.Mon avis : déplorable""",Organisme de crédit qui vous refuse le. Organisme de crédit qui vous refuse le paiement en 3fois pour un montant d’ environ 600 euros alors que vous êtes solvable et créditeur sur votre compte donc très embêtant et énervant. En plus quand on les contacte pas de réponse pour résoudre le problème. Mon avis déplorable,,"""Organisme crédit refuse … . Organisme crédit refuse paiement 3fois montant 600 euros êtes solvable créditeur compte , embêtant énervant . En contacte , réponse résoudre problème . Mon avis : déplorable""",Organisme crédit refuse . Organisme crédit refuse paiement 3fois montant d ’ 600 euros êtes solvable créditeur compte embêtant énervant . En contacte réponse résoudre problème . Mon avis déplorable,
99168,3,10.0,2022-03-07 17:44:57+00:00,2022-03-07,OrangeBank,Bank. Pas top je ne recommanderais pas,Pas top je ne recommanderais pas,,Bank . Pas top recommanderais,Pas top recommanderais,
29855,5,11.0,2023-09-12 20:01:53+00:00,2023-07-19,Cofidis,Les interlocuteurs de Cofidis sont…. Les interlocuteurs de Cofidis sont affables et compétents pour traiter les différentes situations qui leur sont soumises. Bien Cordialement. Jean-Marie CARTIER,Les interlocuteurs de Cofidis sont. Jean-Marie CARTIER,Les interlocuteurs de Cofidis sont affables et compétents pour traiter les différentes situations qui leur sont soumises. Bien Cordialement,Les interlocuteurs Cofidis … . Les interlocuteurs Cofidis affables compétents traiter situations soumises . Bien Cordialement . Jean-Marie CARTIER,Les interlocuteurs Cofidis . Jean-Marie CARTIER,Les interlocuteurs Cofidis affables compétents traiter situations soumises . Bien Cordialement
29416,5,1.0,2023-09-19 04:44:26+00:00,2023-08-31,Cofidis,"""Déroulement facile. Déroulement facile, argent débloquer rapidement, clair net et précis""",,Déroulement facile. Déroulement facile argent débloquer rapidement clair net et précis,"""Déroulement facile . Déroulement facile , argent débloquer rapidement , clair net précis""",,Déroulement facile . Déroulement facile argent débloquer rapidement clair net précis
84873,1,7.0,2022-12-28 13:28:35+00:00,2022-12-27,BoursoramaBanque,"""Complètement HAS BEEN !?. Je suis client de deux banques, boursorama et fortuneo.Les deux ont des avantages et des inconvénients mais en fait, je ne suis satisfait d'aucune de ces deux banques.Pour Boursorama la gestion des limites de paiement et de retrait est incroyable !Pour pouvoir faire 1100 euros de retrait sur un dab il faut avoir un encours de 25 000 euros !C'est complètement dingue ?!""",Complètement HAS BEEN. Les deux ont des avantages et des inconvénients mais en fait je ne suis satisfait d' aucune de ces deux banques. Pour pouvoir faire 1100 euros de retrait sur un dab il faut avoir un encours de 25 000 euros,Je suis client de deux banques boursorama et fortuneo. Pour Boursorama la gestion des limites de paiement et de retrait est incroyable. C' est complètement dingue,"""Complètement HAS BEEN ! ? . Je client banques , boursorama fortuneo . Les avantages inconvénients , satisfait aucune banques . Pour Boursorama gestion limites paiement retrait incroyable ! Pour pouvoir faire 1100 euros retrait dab faut encours 25 000 euros ! C' complètement dingue ? !""",Complètement HAS BEEN . Les avantages inconvénients satisfait d ' aucune banques . Pour pouvoir faire 1100 euros retrait dab faut encours 25 000 euros,Je client banques boursorama fortuneo . Pour Boursorama gestion limites paiement retrait incroyable . C ' complètement dingue
2179,5,1.0,2022-10-28 11:11:51+00:00,2022-10-28,Green-Got,"""Un reget? Que ça n'existait pas plus tôt!. J'ai découvert Green-Got un peu plus d'un an après le début de l'ouverture des pré-comptes. Et depuis, je sui fan de ce projet, de cette banque.Tout d'abord pour sa vocation, de l'argent propre et vert. Ensuite pour son application, simple, user-friendly sur laquelle on peut suivre l'impact de nos dépenses, de notre argent.Mais surtout, pour son équipe, à l'écoute, qui avance avec ses clients, une équipe Care qui répond rapidement.Vous cherchez à faire une bonne action sans avoir à dépenser trop d'énergie? Venez chez GG, ça vous prendra 6 min top chrono pour vous inscrire, et vous aurez une carte en bois avec du vrai argent dessus!""",Un reget. un peu plus d' un an après le début de l' ouverture des pré-comptes. Vous cherchez à faire une bonne action sans avoir à dépenser trop d' énergie,Que ça n' existait pas plus tôt!. J' ai découvert Green. Et depuis je sui fan de ce projet de cette banque. Tout d' abord pour sa vocation de l' argent propre et vert. Ensuite pour son application simple user friendly sur laquelle on peut suivre l' impact de nos dépenses de notre argent. Mais surtout pour son équipe à l' écoute qui avance avec ses clients une équipe Care qui répond rapidement. Venez chez GG ça vous prendra 6 min top chrono pour vous inscrire et vous aurez une carte en bois avec du vrai argent dessus,"""Un reget ? Que existait tôt!. J' découvert Green - Got an début ouverture pré-comptes . Et , sui fan projet , banque . Tout vocation , argent propre vert . Ensuite application , simple , user - friendly impact dépenses , argent . Mais , équipe , écoute , avance clients , équipe Care répond rapidement . Vous cherchez faire bonne action dépenser trop énergie ? Venez GG , prendra 6 min top chrono inscrire , aurez carte bois vrai argent !""",Un reget . d ' an début l ' ouverture pré-comptes . Vous cherchez faire bonne action dépenser trop d ' énergie,Que n ' existait tôt!. J ' découvert Green . Et sui fan projet banque . Tout d ' vocation l ' argent propre vert . Ensuite application simple user friendly l ' impact dépenses argent . Mais équipe l ' écoute avance clients équipe Care répond rapidement . Venez GG prendra 6 min top chrono inscrire aurez carte bois vrai argent
6915,5,1.0,2022-03-31 12:39:33+00:00,2022-03-31,Helios.do,Parfait j’adore cette banque. na,,Parfait j’ adore cette banque,Parfait adore banque .,,Parfait j ’ adore banque
61535,5,3.0,2017-04-18 15:55:44+00:00,2017-04-18,Immoprt,"""Rapide et efficace. Rapide et efficace, avec un suivi régulier pour mener à bien la négociation.""",,Rapide et efficace. Rapide et efficace avec un suivi régulier pour mener à bien la négociation,"""Rapide efficace . Rapide efficace , suivi régulier mener bien négociation .""",,Rapide efficace . Rapide efficace suivi régulier mener bien négociation
53792,5,4.0,2023-04-21 20:36:44+00:00,2023-04-21,MaFrenchBank,"""Sa fait plus que un ans que je suis…. Sa fait plus que un ans que je suis client , vous avez un service clients dédiée aux clients MA FRENCH BANK qui est vraiment rapide et efficace franchement BRAVO je profite l occasion de remercier toutes l équipe MA FRENCH BANK pour leurs compétence 👏😊""",Sa fait plus que un ans que je suis,Sa fait plus que un ans que je suis client vous avez un service clients dédiée aux clients MA FRENCH BANK qui est vraiment rapide et efficace franchement BRAVO je profite l occasion de remercier toutes l équipe MA FRENCH BANK pour leurs compétence. 👏 😊,"""Sa ans … . Sa ans client , avez service clients dédiée clients MA FRENCH BANK vraiment rapide efficace franchement BRAVO profite l occasion remercier l équipe MA FRENCH BANK compétence 👏 😊""",Sa ans,Sa ans client avez service clients dédiée clients MA FRENCH BANK vraiment rapide efficace franchement BRAVO profite l occasion remercier l équipe MA FRENCH BANK compétence . 👏 😊
70119,3,5.0,2022-11-03 17:32:40+00:00,2022-11-02,Monabanq,"""La mise à jour du relevé est décalée. La mise à jour du relevé est décalée par rapport à la réalité, ce qui peut poser des problèmes quant au solde crédit réel.Il serait souhaitable que la mise à jour soit instantanée comme dans la plupart des banques ou au plus, journalière de ma manière que chaque soir on ait le solde comptable réel.""",La mise à jour du relevé est décalée,La mise à jour du relevé est décalée par rapport à la réalité ce qui peut poser des problèmes quant au solde crédit réel. Il serait souhaitable que la mise à jour soit instantanée comme dans la plupart des banques ou au plus journalière de ma manière que chaque soir on ait le solde comptable réel,"""La mise jour relevé décalée . La mise jour relevé décalée rapport réalité , poser problèmes solde crédit réel . Il souhaitable mise jour instantanée plupart banques , journalière manière soir solde comptable réel .""",La mise jour relevé décalée,La mise jour relevé décalée rapport réalité poser problèmes solde crédit réel . Il souhaitable mise jour instantanée plupart banques journalière manière soir solde comptable réel
7721,1,12.0,2021-11-26 12:08:11+00:00,2021-09-16,CarrefourBanque&Assurance,"""Arnaqueurs, à fuir!. J’ai pris une carte pass pour pouvoir financer un voyage carrefour en plusieurs fois. Cela n’a pas été possible car le délai de traitement était trop long et notre voyage était très proche. En plus de ça, on nous a très clairement forcé la main et facturé 28 euros (alors que nous n’avions besoin que d’une seule carte), soit 2 cartes. Le comble, c’est qu’à notre retour de vacances, il n’y avait qu’une seule carte dans notre boîte aux lettres. J’appelle carrefour et là… 10 euros de frais supplémentaires pour en refaire une. Non seulement vous n’avez pas fait votre travail, mais en plus vos techniques commerciales sont plus que douteuses. Une chose est sure : je ne renouvellerai pas l’expérience et je déconseille fortement.""",à fuir!. J’ ai pris une carte pass pour pouvoir financer un voyage carrefour en plusieurs fois. Cela n’ a pas été possible car le délai de traitement était trop long et notre voyage était très proche. En plus de ça on nous a très clairement forcé la main et facturé 28 euros alors que nous n’ avions besoin que d’ une seule carte soit 2 cartes. Le comble c’ est qu’ à notre retour de vacances il n’ y avait qu’ une seule carte dans notre boîte aux lettres. J’ appelle carrefour et là 10 euros de frais supplémentaires pour en refaire une. Non seulement vous n’ avez pas fait votre travail mais en plus vos techniques commerciales sont plus que douteuses. Une chose est sure je ne renouvellerai pas l’ expérience et je déconseille fortement,,"""Arnaqueurs , fuir!. J’ pris carte pass pouvoir financer voyage carrefour fois . Cela été délai traitement trop long voyage . En , clairement forcé main facturé 28 euros ( avions besoin carte ) , 2 cartes . Le comble , vacances , carte boîte lettres . J’ appelle carrefour … 10 euros frais supplémentaires refaire . Non avez travail , techniques commerciales douteuses . Une chose sure : renouvellerai expérience déconseille fortement .""",fuir!. J ’ pris carte pass pouvoir financer voyage carrefour fois . Cela n ’ été délai traitement trop long voyage . En clairement forcé main facturé 28 euros n ’ avions besoin d ’ carte 2 cartes . Le comble c ’ qu ’ vacances n ’ qu ’ carte boîte lettres . J ’ appelle carrefour 10 euros frais supplémentaires refaire . Non n ’ avez travail techniques commerciales douteuses . Une chose sure renouvellerai l ’ expérience déconseille fortement,
66516,5,1.0,2023-10-20 06:44:38+00:00,2023-10-19,Pixpay,Application intuitive et très pratique. Application intuitive et très pratique. Je l'utilise pour mes 2 fils et cela simplifie grandement la question de l'argent de poche.,,Application intuitive et très pratique. Application intuitive et très pratique. Je l' utilise pour mes 2 fils et cela simplifie grandement la question de l' argent de poche,Application intuitive pratique . Application intuitive pratique . Je utilise 2 fils simplifie grandement question argent poche .,,Application intuitive pratique . Application intuitive pratique . Je l ' utilise 2 fils simplifie grandement question l ' argent poche
